贴吧名,帖子标题,ID,内容,发布时间
党建吧,【长庆路街道枫叶社区】普法宣传进社区 助创“平安法,贴吧用户_GU5U9M1,"为深入贯彻落实“五星支部”创建工作要求，3月24日上午长庆路街道枫叶社区聚焦平安建设，对标对表，深入推动普法宣传进社区，助创“平安法治星”活动，不断提高群众的安全感和满意度。
讲座中，长庆办枫叶社区书记刘松林主要围绕《民法典》的家庭、婚姻、继承等法律问题开讲授课，将之与现行《中华人民共和国婚姻法》、《中华人民共和国继承法》作新旧对比，对居民日常中存在疑难、热点问题进行有针对性讲解，现场授课气氛非常活跃。
刘书记用通俗易懂的语言，向大家解读了《民法典》亮点，并对离婚冷静期、高空抛物、个人信息受保护等与居民生活息息相关的方面开展了普法宣讲，加深了大家对《民法典》颁布实施的重要意义的理解和认识。",2024-03-25 10:47
党建吧,【长庆路街道枫叶社区】普法宣传进社区 助创“平安法,孙小眼2014,深入党建引领，争创“平安法治星”，深入推动普法宣传进社区，不断提高群众的安全感和满意度。,2024-03-25 15:21
党建吧,【长庆路街道枫叶社区】普法宣传进社区 助创“平安法,一笑置之33,让民法典知识走到群众身边、走进群众心里,2024-03-25 15:53
