贴吧名,帖子标题,ID,内容,发布时间
孙笑川吧,在知乎看到一个恶心一整年,妾书不为偷人书,"怎么让丈夫真心原谅我?事情是这样的，，我和我丈夫认识十年，现在结婚三年半，育有一个女儿，目前我在读研，丈夫在异地工作并和婆婆带孩子
我们从确认男女关系，一直到结婚后如今，一直是异地的状态。因为一开始我们都在上大学，后来丈夫工作，我大学毕业想参加一个赴外的项目，需要出国，我丈夫（当时还是男朋友）最后也支持了，我们异国了一段时间，后来我萌发了考研的念头，我们商量后，决定回国考研和读研。然后我就毁约回国，我赴外的工资全部用来支付违约金，剩下大几千丈夫出。
回国后我们就迅速结婚，然后我读研期间，感觉毕业后要孩子年龄太大，然后就决定休学一年要一个孩子。至此，我们的关系都是很好的，也算是经历了七年异地异国的风风雨雨。
—————开始出现隐患
但是要孩子期间就出了问题，月份小的时候，我在学校读研，月份大的时候我就休回老家，我也是希望在我们三四线的老家生孩子，为我们的小家省钱。由于丈夫不在老家，最后变成了婆婆辞职在老家照顾我。然后就是无尽的痛苦，婆婆就是那种一辈子农民的，观念什么的完全没法相处，很多东西都是我自己在忍受，我也没法给丈夫说，毕竟是他亲妈。
然后生孩子后更加严峻，当时我不希望婆婆照顾生产和月子，生产是丈夫和我亲妈照顾的，月子是去的月子中心，但是我丈夫在我出月子后总得去他工作的城市工作，我带着孩子回家后又是和婆婆相处的痛苦煎熬，吃饭、带孩子、怎么养孩子等等等。中间发生了很多矛盾，甚至撕破脸面。我最痛苦的是，在那个最痛苦的日子，我的的丈夫一直在拖，只说些不痛不痒的话，没有明确的站在我的身边。我感觉我丈夫心中他亲妈比我更加重要。那段日子对我来说简直就是噩梦。
还好我们在孩子四个月的时候，丈夫在他工作的大城市租了一个两室一厅，把我和孩子接过去，我才能缓和一下。
—————出现问题
孩子8个月的时候，我结束休学回到了学校，婆婆去带孩子，但是婆媳矛盾的痛苦并没有解决，而是一直在我中反复。后来我希望我的丈夫把老家的市区的楼房卖掉（虽然是我们的新房，但是我们两个人都不在本地，现在让他父母住，未来我毕业后我们确认最终安家的城市，再卖掉换首付），其实我并不会真的让他卖了，我只是希望测试一下他心目中的我的重要性。
不出所望，还是无尽的争吵，我感觉他就是不想让他父母回农村，反正就是不同意卖，也不商量。来来回回吵了个把月。
一直到这件事，在他亲戚家说了起来，包括我希望他卖房子，我们结婚他家里什么都没有出，彩礼是我丈夫自己攒下来的，而且我结婚后就带回了，酒席，婚庆，婚车都是花的我们的钱，房子他家人也只是出了一部分首付，这些都是事实，并没有任何夸张。然后我婆婆和丈夫就生气了，嫌我在外人面前丢他们家人的脸，然后丈夫就给我亲妈打电话告状，说我这些年又是出国，又是考研，又是上学，花了他多少钱甚至给算账，说我花了他几十万。当时他还使用了冷暴力，一直在外面玩游戏，叫他回卧室不回卧室，我气不过就直接回学校了。
——————冷战和犯错
上次吵架后，我回学校后我们就开始了冷战，期间除了偶尔我视频看孩子，我们闭口不谈我们俩个事情。一直持续了一个月，他找我说冷静的够了，希望解决问题，但是希望我低头认错，认为这些年都是他付出不容易，结婚什么的并没有亏待过我，而且我感觉他在拿孩子威胁我，如果我不认错，就不让我看孩子。
然后我们又吵了一架，继续冷战。期间我自己上学开始兼职，向他证明，没有他的供养，我也能生活，认识了一个新的男生。我一开始把我虚构成其他人，向他倾述我的痛苦，尤其是当年婆媳矛盾的煎熬。期间隐瞒了我的真实过去，，后来慢慢随着倾述，我们发展成男女朋友的关系。
有一次，他住在我们学校的附近的酒店，我去房间和他聊天，他想和我发生关系，我过不去心里的坎，拒绝了。我后半夜就回学校。也就是这一次，我丈夫通过手机定位知道我在酒店呆到了后半夜（我们孕期为了安全，一直相互开着定位，可以看到实时位置）。
后来我想散散心，高铁去了他（那个男生）的城市，给他买了礼物，期间他陪了我两三天，我住在他的房间，并没有越过最后一步。
————————-爆发
我和丈夫在电话商量要离婚（主要是我感觉我不止嫁给了他，还嫁给了他的家庭，他让我看不到希望，我没法再和婆婆生活在一起），期间我们要回去谈一次，也就是这次，他又答应我，以后不和他妈在一起住，本来解决了。
但是他又查了我的手机，虽然我删除了聊天记录，他还是从其他的地方翻出来了那个男生的信息。我就承认了我出轨，我当时想着干脆就离了正好，就悄悄个打电话给那个男生让他承认我们发生关系了，于是我丈夫就忍不了了，愿意离婚，并且闹到了我们双方家里，并且办理了协议离婚登记，就等着一个月冷静期过去正式离婚。
————————原谅",2024-04-01 20:08
孙笑川吧,在知乎看到一个恶心一整年,妾书不为偷人书,,2024-04-01 20:10
