贴吧名,帖子标题,ID,内容,发布时间
曝光吧,曝光陈巴尔虎旗人民法院宝日希勒法庭法官要派车逼老人快离婚,赵凤芝xc,"我是辽宁省兴城市居民叫：赵凤芝（74岁），我再婚家庭在内蒙古陈巴尔虎旗，目前我被迫遭离婚，法庭在2个月内接连 2次开庭审理我离婚案件，法院 2次开庭时我都清楚说明：没有过错“不同意离婚”我不离婚。
我属实事实证据是，法官当庭再择日定时间再第3次开庭……逼我本人去法院离婚，我说明：“病了、走不动、去不了法院”这种情况下，法官要派车接我去“宝日希勒法庭”快办离婚。
2022年3月16日第一次开庭.宝日希勒人民法庭审理我离婚案件
2022年5月13日第二次异地网上开庭.宝日希勒人民法庭告知（大杨树人民法庭）协助网上开庭审理我离婚案件
事由开始：
我以前是丧偶单身，经人介绍我认识陈巴尔虎旗人现任老伴（邢老头）比我大6岁，邢老头也是丧偶，我和邢老头于2017年6月登记结婚，开始邢老头的子女就不同意我们结婚，邢老头年迈体弱架不住子女的要挟，在2021年1月27日老邢头大儿子当（代理人）带爸爸父子俩人到宝日希勒人民法庭递上诉状要求和我离婚，并财产分割。
在2022年5月13日大杨树人民法院协助（宝日希勒法庭）异地网上开庭审理我离婚案件。
网上开庭录音视频截图证据如下：



以上图片证据质疑问题：
各地方人民法院受理离婚案件过程，双方当事人应该有冷静期，如一方坚持离婚再上诉一年后法院有权直接判离婚，男女双方办离婚后法院才能进行财产分割下判决。
*以上陈述属实是：
宝日希勒法庭审理我离婚案件不到2个月内2次开庭，2次开庭时我都清楚说明：“没有过错不离婚”…….可是法官当庭却还要择日定时间再第3次开庭逼我离婚，我病了去不了法院办离婚……法官当庭却不依不饶要派车接我本人回异地“宝日希勒法庭”快办离婚。
*以上证据确凿是：
法官滥用权力根本没有法律法规的概念、法官胡来乱来审理我离婚案件程序严重有错误。
民俗离婚通常讲：“宁拆十座庙，不拆一门婚”、民俗离婚通常是劝和不劝离这一类的言论众人皆知都不陌生……可是我年过七旬多再婚4年多与老伴感情很好，是老伴儿女们的干预拆散了我们这门夕阳红老年人婚姻，我又遇到无良黑心的法官办人情案强迫逼我：“不同意离婚不行、不说离婚不行、不快离婚还不行。
我网上实名爆料！揭露内蒙自治区陈巴尔虎旗法院宝日希勒人民法庭法官违法办人情案黑幕！我网上陈述提供属实事实证据愿付一切法律责任！
此贴文爆料发言……如被举报部门投诉侵权为由被封杀禁言……我将贴文音频证据材料递送给国家有关部门追究到底！
实名发帖人：赵凤芝  联系电话：15548036790",2022-07-06 11:37
