贴吧名,帖子标题,ID,内容,发布时间
结婚吧,力挺离婚冷静期周文强为何如此失态,及现金卡拉肚子,"近日，民法典草案明确了“离婚冷静期”的规定。规定表明，自婚姻登记机关收到离婚登记申请之日起30日内，任何一方不愿离婚的，可撤回离婚登记申请。中国知名财商导师周文强老师对此拍手称快，并称此类规定是为那些自愿选择离婚的当事人设置一份离婚的时间缓冲门槛，但是这不是限制其离婚自由。而是通过此种行为促进当事人冷静思考，以便双方可以妥善选择、慎重决定。
周文强老师总说，“兄弟情深悲欢共，夫妻恩爱生死同。”于是，在遇见身边有学员或朋友向他们诉苦的时候，周老师与太太一起尽力劝夫妻双方解决矛盾。
一次聊天，周老师给我们分享了一个故事。
周老师的一个学员，是一位美貌与能力并存的女子。来听课的时候她30岁，丈夫年轻但事业有为，家里条件优渥，有房有车有产业，并且还有一个3岁的孩子。大家都很疑惑，为什么不在家里好好享受呢，上班多累啊。熟悉了之后她告诉大家，本来他们是准备离婚的，离婚协议都准备好了。
但听了周老师与其太太的课之后，就让自己冷静下来，与老公好好的沟通后，两人达成了协议。自己可以出来上班。上班后，老公在累或是加班的时候可以分担一些家务。之前她做了三年的家庭主妇，白天做家务，晚上在老公面前抱怨都会让他觉得矫揉造作。于是她选择出来听课、上班。家庭情况比原来好多了。后来听说，他们夫妻俩各自事业有为，前几年还生了二胎呢。
有误会与简单矛盾的婚姻，周老师说，一定要劝冷静，提供建议与方法。
周老师强调，婚姻的基础：要互相尊重对方。
美国著名心理学家艾瑞克·弗洛姆曾提出“没有尊重的爱是控制。”在每个人都呼吁“男女平等”的社会中，幸福的婚姻是建立在夫妻平等之上的。周文强老师说，这种平等是指家庭地位的平等，人格和爱情姿态、婚姻的平等。而夫妻的相处之道并不能少的了“尊重”。
周文强老师提到两对夫妻。第一对夫妻里，丈夫面对做了一桌菜的老婆，笑嘻嘻的与朋友说，你们看我这个老婆，忙了这么一大早，累得跟个狗似的，也才勉强把这桌子菜做及格了。另一对夫妻里，女主人在家做了一顿丰盛的晚餐，邀请了老公家的亲戚共进晚餐，她的丈夫会在饭桌上当着众人的面对她说“老婆，谢谢你，辛苦了。”
结果可想而知，前一对夫妻在长此以往的事情累计下，提出了离婚。而另一对习惯尊重对方、常夸赞彼此的夫妻感情更好了。
无论是对于女性还是男性，在婚姻家庭里的地位是一样的。周老师说。要想得到对方的关怀与尊重，那就必然要先尊重对方。
诚然，能够彼此“尊重”的婚姻，才能让两个人都感受到婚姻中的幸福。
周老师与其太太的婚姻便是如此。
周老师特尊重周太太，家里的小事，周太太做出决定时从不插手。对于大事，两人进行了讨论。当意见分歧时，周老师将对此事进行分析并向她解释，以便她可以接受，而不是一味地跟随大男子主义，因此家庭气氛始终非常融洽。
周老师做事情总是以尊重她为出发点，他朋友聚会，说要带上家属，她说不喜欢，他就不勉强。每逢纪念日或情人节的时候，周太太给丈夫送礼物什么的，不管任何东西，周老师每次都会喜笑颜开，让周太太心生满足感。
有人说，夫妻之间的“谢谢”实际上是一个非常尴尬的情况。如此亲密的人实际上不得不说谢谢您的生命。但是实际上，偶尔的“谢谢”会使对方觉得自己的辛苦已经得到解决。即使不能说“谢谢”一词，也可以用其他方式代替，例如眨眨眼，例如亲吻对方的额头。或脸颊，例如说“亲爱的，你真棒”。
所以，使得婚姻破裂的不一定是出轨，也未必是家暴，而是相处时的点滴过程。如若真的选择了离婚，不如先度过冷静期。说不定，转过头，她/他还是你爱的模样。",2020-08-13 15:36
