贴吧名,帖子标题,ID,内容,发布时间
邓家湾村吧,去年离婚较前年降四成多地将减少原因归于离婚冷静期,李渡汉唐,"去年213.9万对夫妻离婚，较前年下降四成：多地将离婚减少的主要原因归于“离婚冷静期” 2022-03-20 15:15 来源: 九派新闻
原标题：去年213.9万对夫妻离婚，较前年下降四成：多地将离婚减少的主要原因归于“离婚冷静期”
民政部官网日前公布的《2021年4季度民政统计数据》显示，去年全年213.9万对夫妻完成离婚登记。这一登记量为2020年（373.3万对）的57.30%，少了159.4万对。
更早前的2019年，404.3万对夫妻完成离婚登记，2018年有380.1万对夫妻完成离婚登记，2017年的这项数据为369.3万对。
需要指出的是，2021年1月1日，《中华人民共和国民法典》正式实施，离婚登记设置30日的“冷静期”。多地此前公布2021年婚姻大数据时，均将离婚登记减少的主要原因归于离婚“冷静期”的实施。
例如，安徽合肥市去年共有16851对夫妻在民政部门办理了离婚。这一数据与2020年同期的34591对相比降幅超过51%。
微信公号“合肥晚报”报道指出，纵向对比历史数据可见，2021年，离婚登记量超过51%的降幅实属罕见。报道称，离婚登记量暴跌成为2021年的普遍现象。究其原因，在民政部门工作人员看来，“冷静期”制度是主要原因。数据显示，2021年1至11月，合肥市申请离婚的数量也有30107对（12月申请的最早需要在次年1月办理），但最终办理离婚的只有16851对，约44%的离婚申请者经过“冷静”，主动或被动撤回离婚申请，选择给婚姻一个重新来过的机会。
山东滨州市民政局称，“冷静期”实行后，大数据显示，提出离婚申请人数不降反增——2021年全市共受理离婚登记申请9000余件，比“冷静期”实行前离婚登记总量还多。但经过“冷静期”和婚姻家庭辅导服务的介入，最终离婚登记办结量为4690件，远低于去年同期量。
【来源：澎湃新闻】",2022-03-20 17:25
